module;name;title;installMethod;version;description;keywords;category;web;included;finished;equivalent;php;database;github
Acme;Acme;ACME Shell Script;wget;3.1.1;A pure Unix shell script implementing ACME client protocol.;ACME|SSL|TLS|Certificates;Utils;;;;;;;acmesh-official/acme.sh
ACME.js;ACME.js;JavaScript ACME Client;npm;3.1.0;JavaScript ACME client for Let's Encrypt.;ACME|Let's Encrypt|SSL|JavaScript;Utils;;;;;;;therootcompany/acme.js
Angular;Angular;Web App Framework;dev;6.7.5;Platform for building mobile and desktop web applications.;Web|Framework|TypeScript|SPA;Developer;;;;;;;angular/angular
Apache2;Apache2;Website;apt;2.4.62;The Apache HTTP Server Project's goal is to build a secure, efficient and extensible HTTP server.;HTTP|Server|Web|Apache;Essential;X;X;;;;;apache/httpd
Audiobookshelf;Audiobookshelf;Audiobook Podcast Server;clone;v2.26.2;Audiobook and podcast server.;Audiobooks|Podcasts|Streaming;Personal;X;;;;;;advplyr/audiobookshelf
Bugzilla;Bugzilla;Bug Tracking System;clone;release-5.3.3;Web-based general-purpose bugtracker and testing tool.;Bug|Tracker|Testing|Web;Developer;X;X;;;X;;bugzilla/bugzilla
btferret;btferret;BLE Library;clone;21.1;BitTorrent tracker ferret.;BitTorrent|Tracker|Search|Tool;Utils;;X;X;;;;petzval/btferret
Busybox;Busybox;Unix Suite;apt;1.35.0;Lightweight set of Unix utilities in a single executable.;Unix|Utilities|Lightweight|Embedded;Utils;;X;X;;;;mirror/busybox
Certbot;Certbot;HTTPS Certificate Generator;apt;2.1.0;Automatically enable HTTPS on your website with EFF's Certbot.;HTTPS|SSL|Certificates|Automation;Utils;;X;;;;;certbot/certbot
ChangeDetection;ChangeDetection;Web Change Tracker;clone;0.50.7;Tool for tracking changes on web pages.;Change|Detection|Web|Tracking;Productivity;X;;;;;;dgtlmoon/changedetection.io
Clang;Clang;C Compiler Frontend;apt;14.0.6;C language family frontend for LLVM.;Compiler|C|LLVM|Frontend;Developer;;X;X;;;;llvm/llvm-project
CMake;CMake;Cross-Platform Build;apt;3.25.1;Cross-platform open-source build system.;Build|System|Cross-platform|Automation;Developer;;X;X;;;;Kitware/CMake
collaboraonline;collaboraonline;Online Office Suite;;;Online office suite for collaborative editing.;Office|Collaboration|Online|Suite;Productivity;X;;;;;;
ConvertX;ConvertX;File Converter Tool;clone;v0.14.1;A simple, fast, and reliable currency converter.;Currency|Converter|Exchange|Rates;Utils;X;;;;;;C4illin/ConvertX
Cyberchef;Cyberchef;Web Data Tool;clone;v10.19.4;Web app for encryption, encoding, compression, and data analysis.;Encryption|Encoding|Data|Analysis;Utils;X;;;;;;gchq/CyberChef
Discourse;Discourse;Community Discussion Platform;clone;v3.4.6;Civilized discussion platform for your community.;Forum|Community|Discussion|Web;Personal;X;X;;;;;discourse/discourse
Docker;Docker;Container Platform;apt (source);28.3.2;Platform for developing, shipping, and running applications in containers.;Container|Virtualization|DevOps|Deployment;Developer;;X;;;;;
Doodle;Doodle;Meeting Scheduler;;;Simple scheduling tool for organizing meetings and polls.;Scheduling|Poll|Meeting|Calendar;Productivity;X;;;;;;
Dovecot;Dovecot;Email Server;apt;2.3.19.1;Secure IMAP and POP3 email server.;Email|IMAP|POP3|Server;Essential;;X;;;;;dovecot/core
FFmpeg;FFmpeg;Audio Video Tool;apt;5.1.6;Complete solution to record, convert and stream audio and video.;Video|Audio|Streaming|Conversion;Utils;;X;X;;;;FFmpeg/FFmpeg
Fileflows;Fileflows;File Automation Platform;;;Automation platform for processing and managing files.;Automation|File|Workflow|Processing;Utils;X;;;;X;;
Flarum;Flarum;Simple Forum Software;clone;v1.8.1;Simple forum software for building great communities.;Forum|Community|Discussion|Web;Productivity;X;X;;;X;;flarum/flarum
FreshRSS;FreshRSS;RSS Feed Aggregator;clone;1.26.3;RSS feed aggregator.;RSS|Feed|Aggregator;Personal;X;;;;X;;FreshRSS/FreshRSS
frp;frp;Reverse Proxy Tool;clone;v0.63.0;Fast reverse proxy to expose a local server behind a NAT or firewall to the internet.;Proxy|Reverse|NAT|Tunnel;Utils;;X;;;;;fatedier/frp
fscrypt;fscrypt;Linux Encryption Tool;apt;0.3.3;Tool for managing Linux filesystem encryption.;Encryption|Filesystem|Linux|Security;Utils;;X;X;;;;google/fscrypt
GCC;GCC;GNU Compiler Collection;apt;12.2.0;GNU Compiler Collection.;Compiler|GNU|C|C++;Developer;;X;X;;;;gcc-mirror/gcc
Git;Git;Version Control System;apt;2.39.5;Distributed version control system.;Version|Control|Git|SCM;Developer;;X;X;Github;;;git/git
Gitea;Gitea;Git Service;clone;v1.24.3;Source code Git service.;Git|Version|Control;Developer;X;;;;;;go-gitea/gitea
Go;Go;Go Programming Language;apt;1.19.8;Open source programming language that makes it easy to build simple, reliable, and efficient software.;Language|Programming|Go|Efficient;Developer;;X;X;;;;golang/go
GoAccess;GoAccess;Real-Time Log Analyzer;clone;v1.9.4;Real-time web log analyzer and interactive viewer that runs in a terminal.;Logs|Analytics|Terminal|Web;Developer;X;X;;;;;allinurl/goaccess
GoodIP;GoodIP;VPN;;;Tool for managing and monitoring IP addresses.;VPN|IP|Network;Essential;;;;;;;
Grav;Grav;Flat-File CMS;clone;1.7.48;Modern open source flat-file CMS.;CMS|Flat-file|Web|Modern|Wiki;Productivity;X;X;;;X;;getgrav/grav
HAProxy;HAProxy;Load Balancer Tool;apt;2.8.5;Reliable, high performance TCP/HTTP load balancer.;Load|Balancer|TCP|HTTP;Essential;;;;;;;haproxy/haproxy
HomeAssistant;HomeAssistant;Home Automation Platform;pip;2025.1.4;Open source home automation.;Home|Automation|IoT|Smart;Personal;X;X;;;;;home-assistant/core
Html5QRCode;Html5QRCode;HTML5 QR Scanner;clone;v2.3.8;Minimal QR code scanner using HTML5.;QR|Scanner|HTML5|Web;Utils;X;X;;;;;mebjas/html5-qrcode
Hugo;Hugo;Static Site Generator;apt;0.111.3;Fast and modern static site generator.;Static|Site|Generator|Web;Developer;;X;X;;;;gohugoio/hugo
ImageMagick;ImageMagick;Image Editing Suite;apt;6.9.11.60;Software suite to create, edit, compose, or convert bitmap images.;Image|Editing|Conversion|Graphics;Utils;;X;X;;;;ImageMagick/ImageMagick
Immich;Immich;Photo Video Backup;clone;v1.135.3;Photo and video backup solution.;Photo|Video|Backup;Personal;X;;;Google Photos;;;immich-app/immich
Ionic;Ionic;Cross-Platform UI Toolkit;dev;7.2.0;Open source UI toolkit for building cross-platform mobile, desktop, and web apps.;UI|Mobile|Cross-platform|Framework;Developer;;;;;;;ionic-team/ionic-framework
IOPaint;IOPaint;AI Image Software;clone;iopaint-1.5.3;Image inpainting tool powered by SOTA AI models.;Image|Inpainting|AI|Editing;Utils;X;;;;;;Sanster/IOPaint
Java;Java;Java Programming Language;apt;17.0.15;General-purpose programming language designed for portability and security.;Programming|Language|JVM|OOP;Developer;;X;X;;;;
Jellyfin;Jellyfin;Media Streaming System;clone;v10.10.7;Free Software Media System.;Media|Streaming|Video;Personal;X;;;;;;jellyfin/jellyfin
JitsiMeet;JitsiMeet;Video Conferencing;apt (source);2.0.10314;Secure, fully featured video conferencing.;Video|Conferencing|Secure|WebRTC;Essential;X;X;;Zoom;;;jitsi/jitsi-meet
Joomla;Joomla;Content Management System;clone;5.3.2;Content Management System for publishing web content.;CMS|Web|Publishing|Content;Productivity;X;;;Medium;X;;joomla/joomla-cms
Joplin;Joplin;Note Taking App;clone;server-v3.4.1;Note taking and to-do application with synchronization capabilities.;Notes|To-do|Sync|Markdown;Productivity;X;;;;;;laurent22/joplin
Karakeep;Karakeep;Karaoke;clone;v0.26.0;Karaoke app.;Karaoke|Music|App;Personal;X;;;;;;karakeep-app/karakeep
Kernel;Kernel;Linux Kernel;apt;6.12.34;Linux kernel source tree.;Linux|Kernel|OS|Source;Developer;;X;X;;;;torvalds/linux
LibrePhotos;LibrePhotos;Photos Management Service;clone;;Photos and medias management service.;Photos|Alternative|Gallery;Personal;X;;;Google Photos;;;LibrePhotos/librephotos
Libreqr;Libreqr;QR Code Generator;git;2.0.1;Tool for generating and managing QR codes.;QR|Code|Generator|Utility;Utils;;X;;;;;
LimeSurvey;LimeSurvey;Survey Management Service;clone;6.15.3+250708;Powerful open-source survey tool.;Survey|Tool|Questionnaire|Research;Productivity;X;X;;SurveyMonkey;X;MySQL;LimeSurvey/LimeSurvey
Make;Make;Build Automation Tool;apt;4.3;Utility for maintaining groups of programs from source code.;Build|Automation|Compilation|Utility;Developer;;X;X;;;;
MantisBugTracker;MantisBugTracker;Web Bug Tracker;clone;release-2.27.1;Web-based bug tracking system.;Bug|Tracker|Web|Issue;Developer;X;X;;;X;;mantisbt/mantisbt
MarkdownEditor;MarkdownEditor;Live Markdown Editor;clone;v2;Live Markdown editor.;Markdown|Editor|Live|Writing;Developer;;;;;;;jbt/markdown-editor
Maybe;Maybe;Personal Finance Tool;clone;v0.5.0;Personal finance tool.;Finance|Personal|Budget|Tool;Personal;X;;;;;;maybe-finance/maybe
Mermaid;Mermaid;Diagram Visualization Tool;clone;mermaid@11.9.0;Generation of diagrams and visualizations using text and code.;Diagram|Visualization|Text|Code;Productivity;;;;;;;mermaid-js/mermaid
MeTube;MeTube;YouTube Downloader;clone;20250721;Web GUI for youtube-dl, allowing you to download videos from YouTube and other sites.;YouTube|Download|GUI|Video;Utils;X;;;;;;alexta69/metube
MinIO;MinIO;Object Storage Server;clone;RELEASE.2025-07-18T21-56-31Z;High Performance Object Storage.;Storage|Object|S3|Cloud;Developer;X;;;;;;minio/minio
MongoDB;MongoDB;NoSQL Database;apt (source);;General-purpose, document-based, distributed database.;Database|NoSQL|Document|Distributed;Developer;;;;;;MongoDB;mongodb/mongo
Mosquitto;Mosquitto;MQTT Broker;apt;2.0.11;Open source message broker that implements MQTT protocol.;MQTT|Broker|IoT|Messaging;Utils;;X;X;;;;eclipse-mosquitto/mosquitto
MyDongleCloud;MyDongleCloud;MyDongle.Cloud App;clone;2025-09-09;MyDongle.Cloud app.;MyDongle|Cloud;Essential;;X;X;;;;
MySQL;MySQL;MySQL Database;apt;8.0.42;Open-source relational database management system.;Database|RDBMS|SQL|MySQL;Developer;;X;;;;;mysql/mysql-server
NGINX;NGINX;High-Performance Proxy;apt;;High-performance HTTP and reverse proxy server.;HTTP|Proxy|Server|Web;Developer;;;;;;;nginx/nginx
Node;Node;JavaScript Runtime;tar;v22.17.1;JavaScript runtime built on Chrome's V8 JavaScript engine.;JavaScript|Runtime|V8|Server;Developer;;X;X;;;;nodejs/node
OhMyZsh;OhMyZsh;Zsh Configuration Framework;wget;;Delightful community-driven framework for managing your zsh configuration.;Zsh|Shell|Framework|Configuration;Developer;;;;;;;ohmyzsh/ohmyzsh
Ollama;Ollama;Local LLM Tool;clone;v0.9.7-rc1;Get up and running with large language models locally.;LLM|Local|AI|Language;Essential;X;X;;;;;ollama/ollama
OneTimeEmail;OneTimeEmail;Temporary Email Service;;2025-07-07;Service for generating temporary, disposable email addresses.;Email|Temporary|Disposable|Privacy;Essential;X;X;;;;;
OpenWebUI;OpenWebUI;LLM Web Interface;clone;v0.6.18;User-friendly WebUI for LLMs (formerly Ollama WebUI).;LLM|WebUI|AI|Chat;Essential;X;X;;;;;open-webui/open-webui
osTicket;osTicket;Support Ticket System;clone;v1.18.2;Open source support ticket system.;Ticket|Support|Helpdesk|Web;Productivity;X;X;;;X;MySQL;osTicket/osTicket
OTG;uMTP-Responder;OTG File Server;clone;umtprd-1.6.8;MTP (Media Transfer Protocol) responder.;MTP|Protocol|Media|Transfer;Utils;;X;X;;;;viveris/uMTP-Responder
Pandoc;Pandoc;Document Converter;apt;2.17.1.1;Universal document converter.;Document|Converter|Markup|Format;Productivity;X;X;;;;;jgm/pandoc
PhotoPrism;PhotoPrism;AI Photo Manager;clone;250707-d28b3101e;AI-powered photos app for the decentralized web.;Photos|AI|Decentralized|Gallery;Personal;X;;;Google Photos;;;photoprism/photoprism
PhotoView;PhotoView;Photo Gallery;clone;v2.4.0;Simple and user-friendly photo gallery.;Photo|Gallery|Simple|Web;Personal;X;;;Google Photos;;;photoview/photoview
PHP;PHP;PHP Scripting Language;apt;8.2.28;Popular general-purpose scripting language.;Scripting|Language|Web|PHP;Developer;;X;X;;X;;php/php-src
phpBB;phpBB;Bulletin Board Software;clone;release-3.3.15;Flat-forum bulletin board software solution.;Forum|Bulletin|Board|Web;Productivity;X;;;;X;;phpbb/phpbb
phpList;phpList;Newsletter Manager;composer;2.5.5;Open-source newsletter manager.;Newsletter|Email|Manager|Marketing;Productivity;;X;X;MailChimp;X;;phpList/core
PHPSandbox;PHPSandbox;PHP Online Editor;clone;v3.1;PHP online editor and sandbox.;PHP|Sandbox|Editor|Online;Developer;;;;;;;Corveda/PHPSandbox
Pihole;Pihole;Network Ad Blocker;clone;v.6.1.4;Network-wide ad blocking via your own Linux hardware.;Ad|Blocking|DNS|Network;Utils;;;;;;;pi-hole/pi-hole
Postfix;Postfix;Mail Server;apt;3.7.11;Mail transfer agent for routing and delivering electronic mail.;Email|SMTP|Server|Mail;Essential;;X;;;;;
PrivateBin;PrivateBin;Private Pastebin;clone;1.7.8;Minimalist, open source online pastebin where the server has zero knowledge of pasted data.;Pastebin|Privacy|Zero-knowledge|Web;Utils;X;X;;;X;;PrivateBin/PrivateBin
ProjectSend;ProjectSend;File Sharing Platform;clone;r1720;File sharing solution.;File|Sharing|Upload;Productivity;X;X;;WeTransfer, Google One;X;;projectsend/projectsend
PyMCUProg;PyMCUProg;Microchip Programmer;;3.19.4.61;Python library for programming Microchip microcontrollers.;Microchip|Programming|Python|Microcontroller;Developer;;X;X;;;;microchip-pic-avr-tools/pymcuprog
Python;Python;Python Language;apt;3.11.2, 3.12.9;Python language.;Language|Interpreter;Developer;;X;X;;;;
Qdrant;Qdrant;Vector Search Engine;tar;v1.14.1;Vector similarity search engine.;Vector|Search|Similarity|Engine;Utils;;X;;;;Qdrant;qdrant/qdrant
QRCodeGenerator;QRCodeGenerator;QR Code Generator;clone;v1.8.0;Simple QR code generator.;QR|Code|Generator|Image;Utils;X;X;;;;;bizzycola/qrcode-generator
Radaar;Radaar;Movie Collection Manager;clone;v5.27.2.10142;Movie collection manager for Usenet and BitTorrent users.;File|Manager|Torrent|BitTorrent;Personal;X;;;Vuze;X;;Radarr/Radarr
RethinkDB;RethinkDB;Realtime Database;deb;2.4.4;Open-source database for the realtime web.;Database|Realtime|NoSQL|Web;Developer;;X;;;;;rethinkdb/rethinkdb
RoundCube;RoundCube;Webmail Client;apt;1.6.5;Browser-based multilingual IMAP client.;Email|IMAP|Webmail|Client;Essential;X;X;;;X;SQLite;roundcube/roundcubemail
rspamd;rspamd;Spam Filter System;apt;3.4;Fast, free and open-source spam filtering system.;Spam|Filter|Email|Security;Utils;X;X;X;Gmail;;MySQL;rspamd/rspamd
Rust;Rust;Systems Programming Language;;;Systems programming language that runs blazingly fast.;Language|Systems|Fast|Programming;Developer;;;;;;;rust-lang/rust
Sonarr;Sonarr;Smart PVR;clone;v4.0.15.2941;Smart PVR for newsgroup and bittorrent users.;PVR|TV|Manager|Automation;Personal;X;;;;;;Sonarr/Sonarr
SQLite;SQLite;Embedded SQL Database;apt;3.40.1;Self-contained, serverless, zero-configuration, transactional SQL database engine.;Database|SQL|Serverless|Embedded;Developer;;X;X;;;;sqlite/sqlite
StackEdit;StackEdit;Markdown Editor;clone;v5.15.4;In-browser Markdown editor.;Markdown|Editor|Browser|Writing;Developer;;X;;;;;benweet/stackedit
StirlingPDF;StirlingPDF;PDF Manipulation Tool;clone;v1.0.2;Powerful locally hosted web-based PDF manipulation tool.;PDF|Tool|Web|Manipulation;Utils;X;;;;;;Stirling-Tools/Stirling-PDF
Superset;Superset;Data Visualization Platform;clone;5.0.0;Modern data exploration and visualization platform.;Data|Visualization|BI|Analytics;Productivity;X;;;;;;apache/superset
SunriseCMS;SunriseCMS;Municipal CMS;clone;v1.0.0-alpha.19;Simple CMS for small municipal websites.;CMS|Municipal|Web|Simple;Productivity;;X;;EverArk;;;cityssm/sunrise-cms
Syncthing;Syncthing;File Sync Tool;clone;1.30.0;Continuous file synchronization program.;File|Sync|P2P|Backup;Utils;X;;;;;;syncthing/syncthing
Taiga-UI;Taiga-UI;Angular UI Kit;npm;v4.47.0;Angular UI Kit and components library for Angular developers.;UI|Angular|Components|Library;Developer;X;X;X;;X;;taiga-family/taiga-ui
Transmission;Transmission;BitTorrent Client;clone;4.0.6;Fast, easy, and free BitTorrent client.;BitTorrent|Client|P2P|Download;Utils;X;X;;Vuze;;;transmission/transmission
TriliumNotes;TriliumNotes;Hierarchical Notes App;tar;v0.95.0;Hierarchical note taking application.;Notes|Hierarchical|Knowledge|Base;Productivity;X;X;X;;;;TriliumNext/Notes
TubeArchivist;TubeArchivist;YouTube Media Server;clone;v0.5.4;YouTube media server.;YouTube|Archive|Media;Personal;X;X;;;;;tubearchivist/tubearchivist
TypeScript;TypeScript;Enhanced JavaScript;;;Typed superset of JavaScript that compiles to plain JavaScript.;JavaScript|Typed|Compiler|Web;Developer;;;;;;;microsoft/TypeScript
Unmanic;Unmanic;Media Library Optimizer;pip;;Library optimizer for removing unused metadata from media files.;Media|Optimizer|Metadata|Library;Utils;X;X;;;;;Unmanic/unmanic
Uptime;Uptime;Monitoring Service;clone;1.23.16;Monitoring, uptime, status tool and checker.;Monitoring|Uptime|Status;Utils;X;;;;;;louislam/uptime-kuma
WebSSH2;WebSSH2;Web SSH Client;clone;v0.2.24;SSH client to MyDongle.Cloud in a browser.;SSH|Web|Terminal|Client;Utils;;X;;;;;billchurch/webssh2
Webtrees;Webtrees;Online Genealogy;clone;2.2.1;Online genealogy application.;Genealogy|Family|Tree|Web;Personal;X;X;;;X;MySQL;fisharebest/webtrees
WordPress;WordPress;Content Management System;;;Content Management System for creating websites and blogs.;CMS|Blog|Web|Publishing;Personal;X;;;Medium;X;;
WriteAs;Write.As;Privacy Blogging Platform;;;Minimalist, privacy-focused blogging platform.;Blog|Privacy|Writing|Minimalist;Personal;X;;;Medium;;;
YOURLS;YOURLS;URL Shortener;clone;1.10.1;Your Own URL Shortener.;URL|Shortener|Web;Utils;X;X;;;X;;YOURLS/YOURLS
Youtubedl;Youtube-dl;YouTube Downloader;pip;2025.6.30;Command-line program to download videos from YouTube and other sites.;YouTube|Download|Video|CLI;Utils;;X;;;;;ytdl-org/youtube-dl
ytdlp;yt-dlp;YouTube Downloader Fork;pip;2025.6.30;Fork of youtube-dl with additional features and fixes.;YouTube|Download|Video|CLI;Utils;;X;;;;;yt-dlp/yt-dlp
Zigbee2MQTT;Zigbee2MQTT;Zigbee MQTT Bridge;npm;2.5.1;Zigbee to MQTT bridge.;Zigbee|MQTT|Bridge|IoT;Personal;X;X;X;;;;Koenkk/zigbee2mqtt
